,document,spac_doc,token_doc
3428,편하게 추워지면 좋을거같아여 조금만 입을거같습니당 스타일링하기 사이즈적당하게 맞고 너무 날씨가,편하게 추워지면 좋을 거 같아 여 조금만 입을 거 같습니 당 스타일링 하기 사이즈 적당하게 맞고 너무 날씨가,"['편하다', '추워지다', '좋다', '스타일링', '사이즈', '적당하다', '맞다', '날씨']"
3429,편해요 잘산거 싸게 세일할때 같습니다착화감이,편해요 잘 산 거 싸게 세일할 때 같습니다 착화감이,"['편하다', '자다', '싸다']"
3430,이쁜 같아요 핑크인데 핏이 평범하게 편이라 초여름까지 이뻐요 어우러져서 얇은,이쁜 같아 요 핑크인데 핏이 평범하게 편이라 초여름까지 이 뻐요 어우러져서 얇은,"['예쁘다', '핑크', '평범하다', '편이', '초여름', '얇다']"
3431,입고 사이즈가 커서 입을 생각보다 돌렸는데 줄어서 맞아 있어요 없겠구나,입고 사이즈가 커서 입을 생각보다 돌렸는데 줄어서 맞아 있어요 없겠구나,"['입다', '사이즈', '커서', '생각', '돌리다', '줄다', '맞다']"
3432,잘맞네요 이쁘게 사줬는데 마음에 들어요 두께도 동생 ㅎㅎ,잘 맞네요 이 쁘게 사 줬는데 마음에 들어 요 두께도 동생 ㅎㅎ,"['자다', '맞다', '마음', '두께', '동생']"
3433,마음에 플라워링샀다가 잘낄게요 이거두 세트로 샀어요 들어요 들어서 다른,마음에 플라워링샀다가 잘 낄게요 이 거두 세트로 샀어요 들어 요 들어서 다른,"['마음', '플라워', '사다', '자다', '끼다', '세트', '사다', '들어서다']"
3434,좋습니다 좋게 넉넉하고 구매했습니다양 가성비,좋습니다 좋게 넉넉하고 구매했습니다 양 가성비,"['좋다', '좋다', '넉넉하다', '구매', '가성비']"
3435,재질이 이뻐요 부드러운 보통 맨투맨보단 느낌이고 그래픽이,재질이 이 뻐요 부드러운 보통 맨투맨보단 느낌이고 그래픽이,"['재질', '부드럽다', '보통', '맨투맨', '느낌', '그래픽']"
3436,너무 후에는 가장 세탁 않아 어두운 건조기 살짝 짧지도 듯합니다,너무 후에는 가장 세탁 않아 어두운 건조 기 살짝 짧지도 듯합니다,"['세탁', '어두운', '건조', '살짝', '짧다']"
3437,편해요 청바지와 적당한 있네요 색감이 비슷한 매치가 니트에요 가디건이,편해요 청바지와 적당한 있네요 색감이 비슷한 매치가 니트에 요 가디건이,"['편하다', '청바지', '적당하다', '색감', '매치', '니트', '가디건']"
3438,좋아요 있어요 입고 운동할 안붙어서 무난하고 다니고,좋아요 있어요 입고 운동할 안 붙어서 무난하고 다니고,"['좋다', '입다', '운동', '붙다', '무난', '다니다']"
3439,예뻐요 심플해서 심플이즈베스트 말처럼 라는,예뻐요 심플해서 심플이즈베스트 말처럼 라는,"['예쁘다', '심플', '심플', '베스트']"
3440,디자인 있어서 원자재 예정 약간 안떼고 써볼 생각하면 비싼데 보면,디자인 있어서 원자재 예정 약간 안 떼고 써볼 생각하면 비싼데 보면,"['디자인', '예정', '생각', '비싸다']"
3441,가성비로 너무 이쁩니다 신발을 애매한 따로 최고인듯 않고 나지 날에,가성비로 너무 이쁩니다 신발을 애매한 따로 최고인 듯 않고 나지 날에,"['가성비', '예쁘다', '신발', '애매하다', '최고']"
3442,핏에서 좋은 좋습니다 정말 오히려 없네요 소재나 비싼 바지들도 밀리는,핏에서 좋은 좋습니다 정말 오히려 없네요 소재나 비싼 바지들도 밀리는,"['좋다', '좋다', '소재', '비싸다', '바지', '밀리다']"
3443,훌륭합니다다만 튼튼하고 같아요가격대비 구겨져서 다려서 더운 두께감이 때문에처음에 많이 배송과정에서,훌륭합니다다만 튼튼하고 같아 요 가격 대비 구겨져서 다려서 더운 두께감이 때문에 처음에 많이 배송 과정에서,"['훌륭하다', '튼튼하다', '가격', '대비', '구기다', '다리다', '덥다', '두께', '처음', '배송']"
3444,ㅎㅎ 살짝 이뻐요 일단 걱정이지만 노력의 사용하겠습니다 생각하려구요 흔적이라 탈까봐,ㅎㅎ 살짝 이 뻐요 일단 걱정이지만 노력의 사용하겠습니다 생각하려 구요 흔적이라 탈까봐,"['살짝', '걱정', '사용', '생각', '구요']"
3445,좋을듯요 입어보니 입니다 입기 사랑스럽네요ㅋ예쁜게 봄에 디자인 나온,좋을 듯요 입어보니 입니다 입 기 사랑스럽네요 ㅋ 예쁜 게 봄에 디자인 나온,"['좋다', '입어보다', '사랑스럽다', '예쁘다', '디자인']"
3446,좋은가격에 자극없이 순해요 샀어요 살짝 건조하지만 건성피부에는,좋은 가격에 자극 없이 순해 요 샀어요 살짝 건조하지만 건성 피부에는,"['좋다', '가격', '자극', '순하다', '사다', '살짝', '건조하다', '피부']"
3447,크고 핏이 포인트주기 좋은 좋아요소재도 입어도 빠집니다ㅎㅎ옷자체도 부드러워서 맨살에 니트입니다,크고 핏이 포인트 주기 좋은 좋아요 소재도 입어도 빠집니다ㅎㅎ 옷 자체도 부드러워서 맨 살에 니트입니다,"['크다', '포인트', '주기', '좋다', '좋다', '소재', '입다', '빠지다', '부드럽다', '니트']"
3448,좋네요 다시 했을 목티에 때도 레이어드 리뷰 목걸이랑 배송이 데일리로,좋네요 다시 했을 목티에 때도 레이어드 리뷰 목걸이랑 배송이 데일리로,"['좋다', '레이어', '리뷰', '목걸이', '배송', '일리']"
3449,너무 핏도 좋고 살듯 다른색상도 두께감있음 은근 만족스럽네요운동할 그랬어요 라이브,너무 핏도 좋고 살 듯 다른 색상도 두께감 있음 은 근 만족스럽네요 운동할 그랬어요 라이브,"['좋다', '색상', '두께', '만족스럽다', '운동', '라이브']"
3450,휴대가 카키네요수납 카드장 좋아요 저렴하게 용이합니다 어두운 얇아서 알앗는데 색상이,휴대가 카키네 요 수납 카드 장 좋아요 저렴하게 용이합니다 어두운 얇아서 알 앗는데 색상이,"['휴대', '카키', '수납', '카드', '좋다', '저렴하다', '어두운', '얇다', '색상']"
3451,가격에 무겁긴한데 쵸큼 선물하고싶어요 짱이에요가족 없어요 절때 완전 이퀄리티 대만족,가격에 무겁긴 한데 쵸큼 선물하고 싶어요 짱이에 요 가족 없어요 절 때 완전 이 퀄리티 대 만족,"['가격', '무겁다', '크다', '선물', '가족', '퀄리티', '만족']"
3452,품절되기전에 크지만 이뻐요 얼른 보나츠옷들 구매했어요,품절되기 전에 크지만 이 뻐요 얼른 보나츠 옷들 구매했어요,"['품절', '크다', '얼른', '구매']"
3453,굿굿 색감 힙하네오 아웃도어느낌 같은 개꿀템입니다 걸쳐도 그득한 뉴발 대충,굿굿 색감 힙하네오 아웃도 어 느낌 같은 개꿀 템입니다 걸쳐도 그득한 뉴 발 대충,"['굿굿', '색감', '아웃', '느낌', '걸치다']"
3454,포인트돼서 좋아요 입어보고 예뻐서 샀어요앞에 블랙도 로고가 라일락,포인트돼서 좋아요 입어 보고 예뻐서 샀어요 앞에 블랙도 로고가 라일락,"['포인트', '좋다', '입다', '예쁘다', '사다', '블랙', '로고']"
3455,아주 좋네요 맘에 생각하던 사보는데 르아브 드네요 재질도 좋습니다 나와서,아주 좋네요 맘에 생각하던 사보는데 르아브 드네요 재질도 좋습니다 나와서,"['아주', '좋다', '생각', '사보다', '드네', '재질', '좋다']"
3456,평소 좋아해요 조금 접어입으니 입는 이뻐요배송도 아이에요는 아이도 소매 사이즈,평소 좋아해요 조금 접어 입으니 입는 이 뻐 요배송도 아이에요는 아이도 소매 사이즈,"['평소', '좋아하다', '접다', '입다', '입다', '배송', '늘다', '소매', '사이즈']"
3457,척이 있을거 한사이즈 기존에 바로 만족스럽습니다 만원대에 노란색의 너무 나와서,척이 있을 거 한 사이즈 기존에 바로 만족스럽습니다 만 원대에 노란색의 너무 나와서,"['사이즈', '기존', '만족스럽다', '원대', '노란색']"
3458,좋습니다 장난아니게 와서 예쁘네요 실물이 빨리 배송도,좋습니다 장난 아니게 와서 예쁘네요 실물이 빨리 배송도,"['좋다', '장난', '예쁘다', '실물', '빨리', '배송']"
3459,허리 뽑혀서 너무 다른 데일리템에다 두껍지도 매치해도 멜란지에 브랜드 색감,허리 뽑혀서 너무 다른 데일리템에다 두껍지도 매치해도 멜란지에 브랜드 색감,"['허리', '일리', '두껍다', '매치', '브랜드', '색감']"
3460,고정력도 없이 너무 좋았어요 헹궈져요 따끔함이나 생겨서 사서 빠르게 보내주셔서,고정력도 없이 너무 좋았어요 헹궈져요 따끔함이나 생겨서 사서 빠르게 보내주셔서,"['좋다', '생기다', '사서', '빠르다', '보내다']"
3461,하루만에 좋네요 자연스럽고 이뻐요 왔읍니다 쓰다가 사봤는데 베어그레이프만 배송도 둘다,하루 만에 좋네요 자연스럽고 이 뻐요 왔읍니다 쓰다가 사봤는데 베어 그레이프만 배송도 둘다,"['하루', '만에', '좋다', '자연스럽다', '쓰다', '사보다', '그레이', '배송']"
3462,조금 모두 맘에 정도 색이연청이라고 핏감 어렵습니다 드는데 원단이었으면 보기엔,조금 모두 맘에 정도 색이 연청이라고 핏감 어렵습니다 드는 데 원단이었으면 보기엔,"['핏감', '어렵다', '원단', '보기']"
3463,편합니다신축성 좋을 있어서 운동할때도 굉장히 같아요,편합니다 신축성 좋을 있어서 운동할 때도 굉장히 같아요,"['편하다', '신축', '좋다', '운동', '굉장하다']"
3464,클렌징폼 좋아요 여기가 맛집인거같아서 너무 구매했는데,클렌징 폼 좋아요 여기가 맛집인 거 같아서 너무 구매했는데,"['클렌징', '좋다', '맛집', '구매']"
3465,한벌 소대도 사이즈도 부드럽고 맞아요 구매 고고,한 벌 소대도 사이즈도 부드럽고 맞아요 구매 고고,"['사이즈', '부드럽다', '맞다', '구매']"
3466,프로스펙스 처음사보는데 완전 신발 색감듀 마음에 들고,프로스펙스 처음 사보는데 완전 신발 색 감듀 마음에 들고,"['처음', '사보다', '신발', '마음']"
3467,이쁘네요 싼가격에 라이트브라운이 구매했습니다 고급지게,이쁘네요 싼 가격에 라이트 브라운이 구매했습니다 고급 지게,"['예쁘다', '싸다', '가격', '라이트', '브라운', '구매', '고급', '지게']"
3468,팬츠 처음 입어보는데 이쁘네요 생각보다 버뮤다 바지가 무겁고,팬츠 처음 입어보는데 이 쁘네요 생각보다 버뮤다 바지가 무겁고,"['팬츠', '처음', '입어보다', '예쁘네', '생각', '버뮤다', '바지', '무겁다']"
3469,짱좋아요 잘입고 있네요 원단좋고 너무귀엽고,짱 좋아요 잘 입고 있네요 원단 좋고 너무 귀엽고,"['좋다', '자다', '입다', '원단', '좋다', '귀엽다']"
3470,좋습니다 와서 예뼈졌네요 빨리 배송이 디자인이 팔아서 사용하던 무신사에서도 구매했어요,좋습니다 와서 예 뼈졌네요 빨리 배송이 디자인이 팔아서 사용하던 무신사에서도 구매했어요,"['좋다', '지다', '빨리', '배송', '디자인', '파다', '사용', '무신', '에서도', '구매']"
3471,후다닥 사이즈도 강제취소 같아요 겨울에 구매했습니다 기모도 당해서 도톰하고 만족스럽습니다,후다닥 사이즈도 강제 취소 같아 요 겨울에 구매했습니다 기 모도 당해서 도톰하고 만족스럽습니다,"['사이즈', '겨울', '구매', '모도', '도톰하다', '만족스럽다']"
3472,조금 같아요 블러셔 세일 탄탄한 재질이라서 있을 양말 신을 사고싶었는데,조금 같아 요 블러셔 세일 탄탄한 재질이라서 있을 양말 신을 사고 싶었는데,"['탄탄하다', '재질', '이라서', '양말', '사고']"
3473,팍팍 원하던 완전 묻어왔어요 만족스럽습니다 대로 구리색,팍팍 원하던 완전 묻어왔어요 만족스럽습니다 대로 구리색,"['원하다', '묻다', '만족스럽다']"
3474,화이트는 좋습니다 입을려고 은근 오버하네요 안에 색이랑 샀는데 다운했는데 다른,화이트는 좋습니다 입을 려고 은 근 오버하네요 안에 색이랑 샀는데 다운 했는데 다른,"['화이트', '좋다', '려고', '오버', '사다', '다운']"
3475,좋아요 잘입고 있습니다 이너용으로 원단이 아주 부드러워서,좋아요 잘 입고 있습니다 이너용으로 원단이 아주 부드러워서,"['좋다', '자다', '입다', '원단', '아주', '부드럽다']"
3476,너무 그냥 좋지도 않습니다 배송이 느립니다 나쁘지도 그래요 풀오버처럼 지퍼가,너무 그냥 좋지도 않습니다 배송이 느립니다 나쁘지도 그래요 풀오버처럼 지퍼가,"['좋다', '배송', '느리다', '나쁘다', '오버', '지퍼']"
3477,훨씬예쁘네요 튀지않으까 컸을거같아요쎄일쿠폰으로 저렴하게 잘한듯요였음 으로사길 예뻐요 엄청 산거같아요 사이즈는,훨씬 예쁘네요 튀지 않으까 컸을 거 같아 요쎄일 쿠폰으로 저렴하게 잘한 듯 요였음 으로 사길 예뻐요 엄청 산거 같아 요 사이즈는,"['예쁘다', '튀다', '크다', '쿠폰', '저렴하다', '자다', '사다', '예쁘다', '사다', '사이즈']"
3478,진짜 이월상품으로 예쁘고 산거같아요 따듯해요,진짜 이 월 상품으로 예쁘고 산거 같아 요 따듯해요,"['상품', '예쁘다', '사다', '따다']"
3479,품질도 질감또한 좋네요저렴한가격에 적당하구 사이즈 부드러워 맘에 만질수록 만족해요 들어,품질도 질감 또한 좋네요 저렴한 가격에 적당하구 사이즈 부드러워 맘에 만질수록 만족해요 들어,"['품질', '질감', '좋다', '저렴하다', '가격', '적당하다', '사이즈', '부드럽다', '만족하다']"
3480,좋아요 너무 컬러라 않은 할인가 착해서 흔하지 클래식하고 봄가을 입는게,좋아요 너무 컬러라 않은 할인가 착해서 흔하지 클래식하고 봄 가을 입는 게,"['좋다', '컬러', '할인', '착하다', '흔하다', '클래식', '가을', '입다']"
3481,편해요 잘한듯합니다 엄청 사이에서 발이 고민했는데 가길,편해요 잘한 듯합니다 엄청 사이에서 발이 고민했는데 가 길,"['편하다', '자다', '사이', '고민']"
3482,샀는데 엄청 가격 싸게 같아요수납공간이 크네요포장이 잘되서 산거 옵니다 할인해서,샀는데 엄청 가격 싸게 같아 요수납공간이 크네요 포장이 잘 되서 산 거 옵니다 할인해서,"['사다', '가격', '싸다', '수납', '공간', '크다', '포장', '자다', '할인']"
3483,향이 좋네요 제품도 싶어요 생각보다 되게 다른 구매하고,향이 좋네요 제품도 싶어요 생각보다 되게 다른 구매하고,"['좋다', '제품', '생각', '되게', '구매']"
3484,챙이 짧지만 진짜 일단 이쁘네요 신솔라보다는 시원해요 디자인면에서는 그리고 가볍습니다,챙이 짧지만 진짜 일단 이쁘네요 신 솔라보다는 시원해요 디자인 면에서는 그리고 가볍습니다,"['짧다', '예쁘다', '시원하다', '디자인', '에서는', '가볍다']"
3485,좋아요 얇아서 너무 편합니다 잠이 원단도 워싱감이 예쁜 안오거덩요 바지입니다,좋아요 얇아서 너무 편합니다 잠이 원단도 워싱감이 예쁜 안 오거덩요 바지입니다,"['좋다', '얇다', '편하다', '원단', '예쁘다', '바지']"
3486,매우 폭신해서 편하고 통풍도 제품입니다 잘되서 있습니다 신고 살짝 발이,매우 폭신해서 편하고 통풍도 제품입니다 잘 되서 있습니다 신고 살짝 발이,"['편하다', '통풍', '제품', '자다', '신고', '살짝']"
3487,좋아요 깔끔하고 내구서우좋게 나왔습니다 가성비로 포인트로주기 좋겠어요 있었음 무광도,좋아요 깔끔하고 내구서우 좋게 나왔습니다 가성비로 포인트로 주기 좋겠어요 있었음 무광도,"['좋다', '깔끔하다', '좋다', '가성비', '포인트', '주기', '좋다']"
3488,좋아요 할게요 재질 예쁘고 아주 받았습니다 구매,좋아요 할게요 재질 예쁘고 아주 받았습니다 구매,"['좋다', '재질', '예쁘다', '아주', '구매']"
3489,있을거 입고 여기저기 아더컬러랑 다닐수 구매했어요 같이 같아요,있을 거 입고 여기저기 아 더 컬러랑 다닐 수 구매했어요 같이 같아요,"['입다', '여기저기', '컬러', '다니다', '구매']"
3490,엄청 바람에 세일해서 생각보다 사이즈일거라 사이즈가 비싸버리는 반품하기엔 반품비가 활용해야,엄청 바람에 세일해서 생각보다 사이즈일 거라 사이즈가 비싸버리는 반품하기엔 반품비가 활용해야,"['바람', '일해', '생각', '사이즈', '사이즈', '비싸다', '버리다', '반품', '반품', '활용']"
3491,쓸것같아요 보들보들합니다 무난해서 디자인은 겨울에,쓸 것 같아 요 보들보들합니다 무난해서 디자인은 겨울에,"['쓸다', '보들보들하다', '무난', '디자인', '겨울']"
3492,했어요사이즈 추천합니다 저렴하게 사이즈 구입,했어요 사이즈 추천합니다 저렴하게 사이즈 구입,"['사이즈', '추천', '저렴하다', '사이즈', '구입']"
3493,너무 입을 느낌이 심플한 자리에서 디자인에 입으시려면 따가운 떨어지는 맞아,너무 입을 느낌이 심플한 자리에서 디자인에 입으시려면 따가운 떨어지는 맞아,"['느낌', '심플', '자리', '디자인', '입다', '따갑다', '떨어지다', '맞다']"
3494,하나남은거 재질이에요 재질도 잘샀어요 작은거 작게 오버핏은 얇고 안나오네요 아닌데,하나 남은 거 재질이에 요 재질도 잘 샀어요 작은 거 작게 오버핏은 얇고 안 나오네요 아닌데,"['재질', '재질', '자다', '사다', '작다', '작다', '오버핏', '얇다']"
3495,너무 했는데 생각보다 그러면 기엽네여심지어 나일론 넣어도 디자인이 마감도 백팩들,너무 했는데 생각보다 그러면 기 엽네 여심지어 나일론 넣어도 디자인이 마감도 백팩들,"['생각', '나일론', '넣다', '디자인', '마감']"
3496,한겨울이는 핏도 편하고 잘입을것 이뻐요 얇은 봄이니까 반목이라 두께히트텍 두께입니다,한겨울이는 핏도 편하고 잘 입을 것 이 뻐요 얇은 봄이니까 반목이라 두께 히트텍 두께입니다,"['한겨울', '편하다', '자다', '얇다', '두께', '히트', '두께']"
3497,좋아요 입어질것 두루두루 같아요 가지고잇음 가볍고,좋아요 입어질 것 두루두루 같아 요 가지고 잇음 가볍고,"['좋다', '입다', '두루', '두루', '가볍다']"
3498,휘뚜루마뚜루 합니다 그치만 다녀요 다만 덥긴 목도 세탁해도 아니라서 아무,휘뚜루 마뚜루 합니다 그치만 다녀 요 다만 덥 긴 목도 세탁해도 아니라서 아무,"['휘뚜루', '마뚜루', '그치다', '다니다', '덥다', '기다', '세탁', '아무']"
3499,다음에또살게요 고맙습니다 추천할게요 너무만족합니다 마음에쏙들어요 너무잘산것같아요 가족들이잘샀다고하네요 정말너무마음에드네요 또재구매할게요 친구들이예쁘다고하네요,다음에 또 살게 요 고 맙습니다 추천할게요 너무 만족합니다 마음에 쏙 들어 요 너무 잘 산 것 같아요 가족들이 잘 샀다고 하네요 정말 너무 마음에 드네요 또 재구매할게요 친구들이 예쁘다고 하네요,"['추천', '만족하다', '마음', '자다', '가족', '자다', '사다', '마음', '드네', '친구', '예쁘다']"
3500,피부관리 촉촉합니다 좋아요 좋고 아주 사용하기 발림성 마무리에서 너무,피부 관리 촉촉합니다 좋아요 좋고 아주 사용하기 발림성 마무리에서 너무,"['피부', '관리', '촉촉하다', '좋다', '좋다', '아주', '사용', '발림']"
3501,너무 여성 이전에 사이즈 길이는 갑자기 불편했어요ㅜㅜ발까짐 이쁨발볼넓고 이뻐버려 예루살렘,너무 여성 이전에 사이즈 길이는 갑자기 불편했어요 ㅜㅜ 발까짐 이 쁨발볼 넓고 이 뻐 버려 예루살렘,"['여성', '사이즈', '길이', '불편하다', '넓다', '버리다']"
3502,좋아서 제품으로 발색이 발림성과 똑같이 너무 구매했어요 구매했던,좋아서 제품으로 발색이 발림성과 똑같이 너무 구매했어요 구매했던,"['좋다', '제품', '발색', '발림', '구매', '구매']"
3503,사이즈 아주 너무 재질에 바스락 재질도 수납도 좋구요 좋음 내부,사이즈 아주 너무 재질에 바스락 재질도 수납도 좋구요 좋음 내부,"['사이즈', '아주', '재질', '바스락', '재질', '수납', '좋다', '좋다', '내부']"
3504,핏도 질리지 이게 오래 예쁘고요 않고 쓰기에 보고 매장에서 맘에,핏도 질리지 이게 오래 예쁘고요 않고 쓰기에 보고 매장에서 맘에,"['오래', '예쁘다', '쓰기', '매장']"
3505,훨씬 큰사이즈했더니 카라디자인이 제일 잘맞아요 입을만할거같고 이쁘네요 오트밀은 여름에 약간,훨씬 큰 사이즈 했더니 카라 디자인이 제일 잘 맞아요 입을 만할 거 같고 이 쁘네요 오트밀은 여름에 약간,"['크다', '사이즈', '카라', '디자인', '자다', '맞다', '예쁘네', '오트밀', '여름']"
3506,포인트 이뻐요 약간 소매 색감 부드러워요 베이지 무겁고 되고 니트가,포인트 이 뻐요 약간 소매 색감 부드러워요 베이지 무겁고 되고 니트가,"['포인트', '소매', '색감', '부드럽다', '베이지', '무겁다', '니트']"
3507,여름에 매치할려고 핏도좋고 옷이쁩니다 데님팬츠랑 입으려고샀어요 가격도 괜찮습니다 착하서 딱좋습니다,여름에 매치할려고 핏도 좋고 옷이 쁩니다 데님 팬츠랑 입으려고 샀어요 가격도 괜찮습니다 착하 서 딱 좋습니다,"['여름', '매치', '좋다', '예쁩니다', '데님', '팬츠', '입다', '사다', '가격', '괜찮다', '착하다', '서다', '좋다']"
3508,특이한 줘버림 좋아해서 입을만합니다 여름에도 순위 보유바지중 바지 바로 너무이뻐요,특이한 줘버림 좋아해서 입을 만 합니다 여름에도 순위 보유 바지 중 바지 바로 너무 이뻐요,"['특이하다', '버리다', '좋아하다', '여름', '에도', '바지', '바지', '예쁘다']"
3509,좋아서 같아요 너무 겨울 가성비가 보낼 있을거 따뜻하게 비해 소재도,좋아서 같아 요 너무 겨울 가성비가 보낼 있을 거 따뜻하게 비해 소재도,"['좋다', '겨울', '가성비', '보내다', '따뜻하다', '비다', '소재']"
3510,촉감이 좋은 좋아요 좋습니다색 입기 여름에도 시원해보이고 부들부들 많았는데 두께이고,촉감이 좋은 좋아요 좋습니다색 입기 여름에도 시원해 보이고 부들부들 많았는데 두께이고,"['촉감', '좋다', '좋다', '좋다', '입다', '여름', '에도', '시원하다', '보이', '부들부들', '많다', '두께']"
3511,많이 샀는데 마음에 바스락을 색상이 화면에 비슷해요다른 비교하면 보이는 후에는,많이 샀는데 마음에 바스락을 색상이 화면에 비슷해요 다른 비교하면 보이는 후에는,"['사다', '마음', '바스락', '색상', '화면', '비교']"
3512,원단 봉제 튼튼 힘뽝 무게 세탁 두께 입어도 자수 부드럽고,원단 봉제 튼튼 힘뽝 무게 세탁 두께 입어도 자수 부드럽고,"['원단', '봉제', '틀다', '틀다', '무게', '세탁', '두께', '입다', '자수', '부드럽다']"
3513,하나 가격에 들어요 마음에 원단이나 놓칠 뒤집혀 로고 모두 사이즈는,하나 가격에 들어 요 마음에 원단이나 놓칠 뒤집혀 로고 모두 사이즈는,"['가격', '마음', '원단', '로고', '사이즈']"
3514,다른 사이즈 만족합니다 핏감 컬러도 구입하고싶어요 그대로 제가 입니다 너무,다른 사이즈 만족합니다 핏감 컬러도 구입하고 싶어요 그대로 제가 입니다 너무,"['사이즈', '만족하다', '핏감', '컬러', '구입', '그대로']"
3515,포켓이 포인트되고 컬러 있어 입기에 여름에 얇은 소재여서 생각보다 맘에듭니다,포켓이 포인트 되고 컬러 있어 입기에 여름에 얇은 소재여서 생각보다 맘에 듭니다,"['포켓', '포인트', '컬러', '입다', '여름', '얇다', '소재', '생각', '듭니']"
3516,죄다 자주 있는거 입을듯 싶어요 생각보다 색깔 사봤는데 괜찮네요 겨울옷은,죄다 자주 있는 거 입을 듯 싶어요 생각보다 색깔 사봤는데 괜찮네요 겨울옷은,"['자주', '생각', '색깔', '사보다', '괜찮다', '겨울']"
