,document,spac_doc,token_doc
1167,사이즈도 두루 적당히 이거입고 색감쨍하고 버틸게요 잘쓸꺼같아요 시원하고 넉넉합니다 올여름,사이즈도 두루 적당히 이 거입고 색감쨍하고 버틸게요 잘 쓸꺼 같아 요 시원하고 넉넉합니다 올 여름,"['사이즈', '두루', '적당하다', '입다', '자다', '쓸다', '시원하다', '넉넉하다', '여름']"
1168,흰색도 이쁘네요 이뻐서 예뻐요 블랙사고 구매했어요,흰색도 이 쁘네요 이 뻐서 예뻐요 블랙 사고 구매했어요,"['흰색', '예쁘네', '예쁘다', '블랙', '사고', '구매']"
1169,너무 팬츠를 잘어울립니다 다크그레이 트레이닝 팬츠 가볍고 가지고 나일론 제가,너무 팬츠를 잘 어울립니 다 다크 그레이 트레이닝 팬츠 가볍고 가지고 나일론 제가,"['팬츠', '자다', '어울리다', '다크', '그레이', '트레이닝', '팬츠', '가볍다', '나일론']"
1170,완전 옷에서 오렌지 생각보다 색상이 느낌이에요 냄새가 나요 근데 ㅠㅠ,완전 옷에서 오렌지 생각보다 색상이 느낌이에요 냄새가 나요 근데 ㅠㅠ,"['오렌지', '생각', '색상', '느낌', '냄새', '나요']"
1171,핏도 좋습니다 좋구요 재구매의사 있습니다 역시,핏도 좋습니다 좋구요 재 구매의사 있습니다 역시,"['좋다', '좋다', '구매', '의사']"
1172,진짜 품질 이쁨 이뻐요 안좋은거 아디다스 실물이 근데 같아요,진짜 품질 이 쁨 이 뻐요 안 좋은 거 아디다스 실물이 근데 같아요,"['품질', '좋다', '아디다스', '실물']"
1173,편하고 좋아요 좋아서 재질이 입엇을때 없어서 비침도,편하고 좋아요 좋아서 재질이 입엇을 때 없어서 비침도,"['편하다', '좋다', '좋다', '재질', '비치다']"
1174,많이 샀는데 이번에 ㅎㅎ 제일 옷을 스컬프터에서 추천이요 그중에서 입으려고,많이 샀는데 이번에 ㅎㅎ 제일 옷을 스컬프 터에서 추천이 요 그 중에서 입으려고,"['사다', '추천', '입다']"
1175,좋고 입기 입고다닐거같네요 많이 디자인이 데일리로 너무 귀여워서,좋고 입기 입고 다닐 거 같네요 많이 디자인이 데일리로 너무 귀여워서,"['좋다', '입다', '입다', '다니다', '디자인', '일리', '귀엽다']"
1176,핏도 입고 예뻐서 선물로 색감도 동생 다녀요 구매했는데 괜찮고,핏도 입고 예뻐서 선물로 색감도 동생 다녀요 구매했는데 괜찮고,"['입다', '예쁘다', '선물', '색감', '동생', '다니다', '구매', '괜찮다']"
1177,여름제품도 핏으로 나왔으면 못입을듯해요인생핏입니다 좋겠어요더운날씨엔 하면서도 길이를 넉넉한 보여요 사이즈로,여름 제품도 핏으로 나왔으면 못 입을 듯해 요인 생핏입니다 좋겠어요 더운 날씨엔 하면서도 길이를 넉넉한 보여요 사이즈로,"['여름', '제품', '좋다', '덥다', '날씨', '길이', '넉넉하다', '사이즈']"
1178,마음에 적당하고 재질도 잘맞네요 이정도면 생각했던 사이즈는 만족스러워요 루즈핏으로 디자인이,마음에 적당하고 재질도 잘 맞네요 이 정도면 생각했던 사이즈는 만족스러워요 루즈핏으로 디자인이,"['마음', '적당하다', '재질', '자다', '맞다', '생각', '사이즈', '만족스럽다', '루즈핏', '디자인']"
1179,할듯옷은 카라부분이 점퍼 입어야 예뻐요 얇아서 안에 맘에 들어용,할듯 옷은 카라 부분이 점퍼 입어야 예뻐요 얇아서 안에 맘에 들어용,"['카라', '점퍼', '입다', '예쁘다', '얇다']"
1180,예뻐요 엄청 오래입지는 소재 아우터로도 부드러운데 활용도 이너로도 좋습니당 못할거같아요,예뻐요 엄청 오래 입지는 소재 아우터로도 부드러운데 활용도 이너로도 좋습니 당 못할 거 같아요,"['예쁘다', '오래', '입지', '소재', '아우', '부드럽다', '활용', '좋다']"
1181,항상 하는데 까만 끼임이나 느낌 느낌이라이번엔 미디엄 미디엄도 미디엄딥 밝은,항상 하는데 까만 끼임이나 느낌 느낌이 라 이번엔 미디엄 미디엄도 미디엄 딥 밝은,"['항상', '느낌', '느낌', '미디엄', '미디엄', '미디엄', '밝다']"
1182,핏감 좋은 좋고 재질 자주 입을거 입기 색감까지 봄에 느낌입니다,핏감 좋은 좋고 재질 자주 입을 거 입기 색감까지 봄에 느낌입니다,"['핏감', '좋다', '좋다', '재질', '자주', '입다', '색감', '느낌']"
1183,하면서 푹신해서 편하게 처음 착화감 좋네여 잘맞고 않았는데 아직 신었을,하면서 푹신해서 편하게 처음 착화감 좋네 여 잘 맞고 않았는데 아직 신었을,"['푹신하다', '편하다', '처음', '좋다', '자다', '맞다', '신다']"
1184,편해요 좋고잘 있어서 원하는 밀려요 만큼 깎을,편해요 좋고 잘 있어서 원하는 밀려 요 만큼 깎을,"['편하다', '좋다', '자다', '원하다', '밀리다']"
1185,핏도 좋을거 좋네요 조금더 만족합니다 길었으면 기장이 같은데,핏도 좋을 거 좋네요 조금 더 만족합니다 길었으면 기장이 같은 데,"['좋다', '좋다', '만족하다', '길다', '기장']"
1186,합니다 주는 옷이에요 오바사이즈라 어깨 만족쿠 만들어 나요 깡패 감질맛,합니다 주는 옷이에요 오바 사이즈라 어깨 만족 쿠 만들어 나요 깡패 감질맛,"['사이즈', '어깨', '만족', '만들다', '나요', '깡패', '감다']"
1187,착용했는데도 정사이즈로 괜찮았구요ㅎㅎ 구매하니 남는 덜그럭거리거나하진 맞습니다앞뒤로 맞아서 발등발볼러 발등이,착용했는데도 정 사이즈로 괜찮았구요 ㅎㅎ 구매하니 남는 덜 그럭거리거나 하진 맞습니다 앞뒤로 맞아서 발 등 발 볼러 발 등이,"['착용', '사이즈', '괜찮다', '구매', '거리', '거나', '하진', '맞다', '맞다']"
1188,어깨 있어서 조금 있습니다 디테일을 되는 애장하는 살짝 브랜드입니다버클이 보통,어깨 있어서 조금 있습니다 디테일을 되는 애장하는 살짝 브랜드입니다버클이 보통,"['어깨', '디테일', '살짝', '브랜드', '보통']"
1189,편하게 카라 있어서 입을 없었는데 만족합니다 단추 니트는,편하게 카라 있어서 입을 없었는데 만족합니다 단추 니트는,"['편하다', '카라', '만족하다', '단추', '니트']"
1190,제품도 입을게요 이뻐요잘 빠르고 배송 마음에 들어요,제품도 입을 게요 이 뻐요잘 빠르고 배송 마음에 들어요,"['제품', '게요', '빠르다', '배송', '마음']"
1191,추천합니다 좋은거같어요 이쁘고 실물이 굉장히 가성비,추천합니다 좋은 거 같어요 이 쁘고 실물이 굉장히 가성비,"['추천', '좋다', '실물', '굉장하다', '가성비']"
1192,핏이 예쁘고 조금 돌렸더니 로고도 상큼해요 세탁해서 건조기 줄어듭니다하지만 입기엔,핏이 예쁘고 조금 돌렸더니 로고도 상큼해 요 세탁해서 건조기 줄어듭니다 하지만 입기엔,"['예쁘다', '돌리다', '로고', '상큼', '세탁', '건조기', '줄다', '입다']"
1193,허리가 편이에요 통은 좋은것같아요 조금 작게 넓은 나왔는데 가성비,허리가 편이에 요 통은 좋은 것 같아요 조금 작게 넓은 나왔는데 가성비,"['허리', '편이', '좋다', '작다', '넓다', '가성비']"
1194,입기 엄청 너무 넉넉한 두께에요 빼고 소재도 싸게 한여름 핏이라,입기 엄청 너무 넉넉한 두께에 요 빼고 소재도 싸게 한 여름 핏이라,"['입다', '넉넉하다', '두께', '빼다', '소재', '싸다', '여름']"
1195,지인 적당한 저렴한 선물로 구매했는데 같아요 가격에,지인 적당한 저렴한 선물로 구매했는데 같아 요 가격에,"['지인', '적당하다', '저렴하다', '선물', '구매', '가격']"
1196,훨씬 착화감도 좋습니다 이쁘네요 이쁘고 실물로 색감도 보니 디자인이 너무,훨씬 착화감도 좋습니다 이쁘네요 이 쁘고 실물로 색감도 보니 디자인이 너무,"['감다', '좋다', '예쁘다', '실물', '색감', '디자인']"
1197,확실히 핏이 통기성도 처음 좋아서 좋고 사보는데 만족합니다 린넨이라 린넨보다는,확실히 핏이 통기성도 처음 좋아서 좋고 사보는데 만족합니다 린넨이라 린넨보다는,"['확실하다', '완성도', '처음', '좋다', '좋다', '사보다', '만족하다', '린넨', '린넨']"
1198,제품 역시나 역시 여러벌인데 스탠다드 셋업 벌써 무신사 만족합니다 마음에,제품 역시나 역시 여러 벌인데 스탠다드 셋업 벌써 무신사 만족합니다 마음에,"['제품', '스탠다드', '셋업', '벌써', '물다', '만족하다', '마음']"
1199,진짜 이색상이 예뻐요 색상이 색상도 부드럽고 바지들은 뭔가 맘에 들어요,진짜 이 색상이 예뻐요 색상이 색상도 부드럽고 바지들은 뭔가 맘에 들어요,"['색상', '예쁘다', '색상', '색상', '부드럽다', '바지', '뭔가']"
1200,투명 케이스로 케이스 잘묻을거 아주 쓰다가 실리콘 바꿈색감 미끄러워서 마음에,투명 케이스로 케이스 잘 묻을 거 아주 쓰다가 실리콘 바꿈 색감 미끄러워서 마음에,"['케이스', '케이스', '자다', '묻다', '아주', '쓰다', '색감', '미끄럽다', '마음']"
1201,있어요 입고 타브랜드보다 큰편이네요편안하게 동일사이즈 맨트맨이에요 만족스럽게 꽤나 귀여운 항상,있어요 입고 타 브랜드보다 큰 편이네 요 편안하게 동일 사이즈 맨트맨이에요 만족스럽게 꽤나 귀여운 항상,"['입다', '브랜드', '크다', '편이', '편안하다', '사이즈', '만족', '스럽게', '귀엽다', '항상']"
1202,좋아요 있을것 입을 여름에도 얇아서 생각보다 같아요,좋아요 있을 것 입을 여름에도 얇아서 생각보다 같아요,"['좋다', '여름', '에도', '얇다', '생각']"
1203,틴트색상도 좋은제품 저렴하게 맘에들어요 구매합니다,틴트 색상도 좋은 제품 저렴하게 맘에 들어 요 구매합니다,"['색상', '좋다', '제품', '저렴하다', '구매']"
1204,같은 저는 살짝 입을 있는데 검정색 들어가 거의 말라서 비교했을,같은 저는 살짝 입을 있는데 검정색 들어가 거의 말라서 비교했을,"['살짝', '검정색', '들어가다', '비교']"
1205,좋습니다 마음에 들어요 입히기 소재나 디자인 간절기에 퀄리티가 좋고 상품도,좋습니다 마음에 들어 요 입히 기 소재나 디자인 간절기에 퀄리티가 좋고 상품도,"['좋다', '마음', '입히다', '소재', '디자인', '간절', '퀄리티', '좋다', '상품']"
1206,진짜 좋아요 너무 재질도 예비용으로 살려구요 반팔 ㅠㅜ 러프사이드 정도로,진짜 좋아요 너무 재질도 예비용으로 살려 구요 반 팔 ㅠㅜ 러프사이드 정도로,"['좋다', '재질', '살리다', '구요', '러프', '사이드']"
1207,하네요 예쁘다고 보냈는데 친구생일선물로 넘커서 조아라 잘입겠습니다 이쁘긴한데 동생줬네요동생이 고학년인,하네요 예쁘다고 보냈는데 친구 생일 선물로 넘커서 조아라 잘 입겠습니다 이쁘긴 한데 동생 줬네요 동생이 고 학년인,"['예쁘다', '보내다', '친구', '생일', '선물', '커서', '좋다', '자다', '입다', '예쁘다', '동생', '동생', '학년']"
1208,아이보리 선물받아서 들어야 무난해서 배가 보이는정도라서 부담스럽지 블랙은 블랙이랑 살짝,아이보리 선물 받아서 들어야 무난해서 배가 보이는 정도라서 부담스럽지 블랙은 블랙이랑 살짝,"['아이보리', '선물', '무난', '부담', '스럽지', '블랙', '블랙', '살짝']"
1209,편한데두께가있어서무게감있는편이네여디자인은마음에들어요 작은사이즈인데도너무너무커요그래서다른사람줬어요 좋아요아주좋습싀니다꽤나마음에들어요옹히히 싸게사서만족해요연한더티워싱이라서부담스럽지않아요 재구매입니다너무이뻐서지인선물로사줬습니다 어깨끈이긴거같은데나만그런것인지수선했음기엽습니다 바람막이하나사고싶었는데 보통기본라인만입는데 간만에맘에드는티셔츠네요 쿠어제품너무이쁘네요,편한데 두께가 있어서 무게감 있는 편이 네여 디자인은 마음에 들어 요 작은 사이즈인데도 너무 너무 커요 그래서 다른 사람 줬어요 좋아요아주 좋습 싀니다 꽤나 마음에 들어 요옹히 히 싸게 사서 만족해요 연한 더티워싱이라서 부담스럽지 않아 요 재구매입니다 너무 이뻐서지인 선물로 사줬습니다 어깨끈이 긴 거 같은데 나만 그런 것인지 수선했음기 엽습니다 바람막이 하나 사고 싶었는데 보통 기본 라인만 입는데 간 만에 맘에 드는 티셔츠네요 쿠어 제품 너무 이쁘네요,"['펴다', '두께', '무게', '편이', '디자인', '마음', '작다', '사이즈', '크다', '사람', '좋다', '아주', '좋다', '마음', '싸다', '사서', '만족하다', '이라서', '부담', '스럽지', '예쁘다', '지인', '선물', '사주다', '어깨', '기다', '인지', '수선하다', '바람막이', '사고', '보통', '기본', '라인', '입다', '만에', '티셔츠', '쿠어', '제품', '예쁘다']"
1210,짧은감이 있어요 여름 슬렉스인데 생각보다 밴딩 기장이,짧은 감이 있어요 여름 슬렉스인데 생각보다 밴딩 기장이,"['짧다', '여름', '생각', '밴딩', '기장']"
1211,좋습니다 좋고색감도 사이즈도 디자인도 낙낙하고,좋습니다 좋고 색감도 사이즈도 디자인도 낙낙하고,"['좋다', '좋다', '색감', '사이즈', '디자인', '낙하']"
1212,핏도 좋고 이쁘네요 사는데 골덴바지 개째 가성비,핏도 좋고 이쁘네요 사는 데 골덴바지 개째 가성비,"['좋다', '예쁘다', '살다', '가성비']"
1213,좋고 저렴하게 사이즈가 무엇보다 넉넉해서 구입했어요,좋고 저렴하게 사이즈가 무엇보다 넉넉해서 구입했어요,"['좋다', '저렴하다', '사이즈', '넉넉하다', '구입']"
1214,예쁘고 얼추 사이즈도 맞습니다 만족합니다 디자잉,예쁘고 얼추 사이즈도 맞습니다 만족합니다 디자잉,"['예쁘다', '사이즈', '맞다', '만족하다']"
1215,편하고 좋아서 있습니다 입고 예뻐요편하게 소재 다니고,편하고 좋아서 있습니다 입고 예뻐요 편하게 소재 다니고,"['편하다', '좋다', '입다', '예쁘다', '편하다', '소재', '다니다']"
1216,편하고 좋아요 아주 살짝 부들부들한게 맘에 드네요 두껍긴한데,편하고 좋아요 아주 살짝 부들부들한 게 맘에 드네요 두껍긴 한데,"['편하다', '좋다', '아주', '살짝', '부들부들하다', '드네', '두껍다']"
1217,편하게 좋네요 입을거 수고하세요 사이즈도 맞고 같아요,편하게 좋네요 입을 거 수고하세요 사이즈도 맞고 같아요,"['편하다', '좋다', '수고', '사이즈', '맞다']"
1218,편하고 좋아요 입었을때 신축성도 부드러워 만족합니다,편하고 좋아요 입었을 때 신축성도 부드러워 만족합니다,"['편하다', '좋다', '입다', '신축', '완성도', '부드럽다', '만족하다']"
1219,프린팅이 좋아요 재질도 일단 역시나 너무 귀여워요,프린팅이 좋아요 재질도 일단 역시나 너무 귀여워요,"['프린팅', '좋다', '재질', '귀엽다']"
1220,되게 편하게 좋아요 가벼워서 입기 여름에 조절 있어서 좋아요잘 커요,되게 편하게 좋아요 가 벼워서 입기 여름에 조절 있어서 좋아요 잘 커요,"['되게', '편하다', '좋다', '벼워', '입다', '여름', '조절', '좋다', '자다', '크다']"
1221,향이 편이고 은은한 오래 맘에 들어여 남아있어서,향이 편이고 은은한 오래 맘에 들어 여 남아 있어서,"['편이', '은은하다', '오래', '남아']"
1222,편하고 예쁘네요 엄청 사이즈 마지막 남은 가볍고,편하고 예쁘네요 엄청 사이즈 마지막 남은 가볍고,"['편하다', '예쁘다', '사이즈', '가볍다']"
1223,적절한 적당한 색상 사이즈 사야겠어요 다른색상도,적절한 적당한 색상 사이즈 사야겠어요 다른 색상도,"['적절하다', '적당하다', '색상', '사이즈', '사다', '색상']"
1224,핏이 쿠어는 좋아요 역시 어깨깡패핏인듯 만족합니다,핏이 쿠어는 좋아요 역시 어깨깡 패핏인 듯 만족합니다,"['쿠어', '좋다', '어깨', '만족하다']"
1225,핏도 저렴한 입겠습니다 이너 예쁜 감사요 가격에,핏도 저렴한 입겠습니다 이너 예쁜 감사요 가격에,"['저렴하다', '입다', '예쁘다', '감사', '가격']"
1226,너무 하루만에 편하게 같아요 모델과 바지 배송도 버전이에요 비교하면 색감은,너무 하루 만에 편하게 같아 요 모델과 바지 배송도 버전이에 요 비교하면 색감은,"['하루', '만에', '편하다', '모델', '바지', '배송', '버전', '비교', '색감']"
1227,에스사이즈도조금크긴하지만오버핏이라괜찮아요 합리적인가격고맙습니다선물용이라고했습니다 사이즈잘맞고핏이이뻐요원단도기존블레이져보다얇아요 삿어용 지갑으로하려구 비싼지갑피료없음넘기여웡 허리사이즈랑 더운여름 너무귀엽습니다 두껍진않아요,에스사이즈도 조금 크긴 하지만 오버핏이라 괜찮아요 합리적인 가격 고맙습니다 선물용이라고 했습니다 사이즈 잘 맞고 핏이 이 뻐요원단도 기존 블레이져보다 얇아요 삿어용 지갑으로 하려 구 비싼 지갑피료 없음 넘기여웡 허리 사이즈랑 더운 여름 너무 귀엽습니다 두껍진 않아요,"['에스', '사이즈', '크다', '오버핏', '괜찮다', '합리', '가격', '선물', '용이', '사이즈', '자다', '맞다', '기존', '얇다', '지갑', '비싸다', '지갑', '허리', '사이즈', '덥다', '여름', '귀엽다', '두껍다']"
1228,좋아요 사이즈도 작지도 않아서 사용하기편해여 크지도 괜찮고 까끌거리지 촉감도 쫀쫀해서,좋아요 사이즈도 작지도 않아서 사용하기 편해 여 크지도 괜찮고 까끌거리지 촉감도 쫀쫀해서,"['좋다', '사이즈', '지도', '사용', '편하다', '크다', '괜찮다', '촉감', '쫀쫀해']"
1229,사이즈로 운동화 사며 헤야될듯 업은 안맞음반업이나 맞다길래 갔는데 구입 라구,사이즈로 운동화 사며 헤야될 듯 업은 안 맞음반업이나 맞다길래 갔는데 구입 라구,"['사이즈', '운동화', '사다', '업다', '맞다', '맞다', '구입']"
1230,잘샀어요 배송은 디자인도 느렸지만 귀여워요 가격에,잘 샀어요 배송은 디자인도 느렸지만 귀여워요 가격에,"['자다', '사다', '배송', '디자인', '느리다', '귀엽다', '가격']"
1231,해서 이번엔 예뻐요 색상 샀다가 샀네요 사이즈 마음에 들어서 다른,해서 이번엔 예뻐요 색상 샀다가 샀네요 사이즈 마음에 들어서 다른,"['예쁘다', '색상', '사다', '사다', '사이즈', '마음', '들어서다']"
1232,핏되고 짧지 좋아요 적당히 않고 사이즈 맞아요 길이도,핏되고 짧지 좋아요 적당히 않고 사이즈 맞아요 길이도,"['핏되', '짧다', '좋다', '적당하다', '사이즈', '맞다', '길이']"
1233,프라이데이에 자주 같네요 구매하고 그래픽 나가지는 다만 들어요 디테일이 마음에,프라이데이에 자주 같네요 구매하고 그래픽 나가지는 다만 들어 요 디테일이 마음에,"['자주', '구매', '그래픽', '나가다', '디테일', '마음']"
1234,좋은 좋았어요몸에 좋네요 있어서 맞으니 너무 구매할 가격에,좋은 좋았어요 몸에 좋네요 있어서 맞으니 너무 구매할 가격에,"['좋다', '좋다', '좋다', '맞다', '구매', '가격']"
1235,키가 커서 좋네요 입는데 입기 옷은 오버핏으로 예뻐요 사이즈가,키가 커서 좋네요 입는데 입기 옷은 오버핏으로 예뻐요 사이즈가,"['커서', '좋다', '입다', '입다', '오버핏', '예쁘다', '사이즈']"
1236,훌륭합니다 퀄리티 저렴한데 대비 굉장히 가격이 가격,훌륭합니다 퀄리티 저렴한데 대비 굉장히 가격이 가격,"['훌륭하다', '퀄리티', '저렴하다', '대비', '굉장하다', '가격', '가격']"
1237,탄탄하고 재질도 자수포인트도 예쁩니다 깔끔하게,탄탄하고 재질도 자수 포인트도 예쁩니다 깔끔하게,"['탄탄하다', '재질', '자수', '포인트', '예쁘다', '깔끔하다']"
1238,편입니다저렴하게 좋을 입기 여름이 엄청 아니고 사이즈도 두께감은 두꺼운 구매해서,편입니다 저렴하게 좋을 입기 여름이 엄청 아니고 사이즈도 두께감은 두꺼운 구매해서,"['편입', '저렴하다', '좋다', '입다', '여름', '사이즈', '두께', '감다', '두껍다', '구매']"
1239,한여름에는 한데 조금 이뻐요 생각보다 색이랑 살짝 목쪽이 더울 답답하긴,한여름에는 한데 조금 이 뻐요 생각보다 색이랑 살짝 목쪽이 더울 답답하긴,"['한여름', '생각', '살짝', '덥다']"
1240,추가 예정입니다 색상도 맘에 듭니다 다른 구매,추가 예정입니다 색상도 맘에 듭니다 다른 구매,"['추가', '예정', '색상', '듭니', '구매']"
1241,예쁨 수납공간도 배송은 디자인은 느렸지만 넓고 너무,예쁨 수납공간도 배송은 디자인은 느렸지만 넓고 너무,"['예쁘다', '수납', '공간', '배송', '디자인', '느리다', '넓다']"
1242,입을 샀는데 합니다 휘뚜루마뚜루 아울렛으로 아이템 여행가서 재질이 여름에 도톰해요,입을 샀는데 합니다 휘뚜루 마 뚜루 아울렛으로 아이템 여행가서 재질이 여름에 도 톰해요,"['사다', '휘뚜루', '휘뚜루', '아이템', '여행가', '재질', '여름', '톰해']"
1243,핏이에여 편해요 코디하기 제가 이뻐서 원하던 색감도,핏이에 여 편해요 코디하기 제가 이 뻐서 원하던 색감도,"['핏이', '편하다', '코디', '원하다', '색감']"
1244,이쁘고 디자인도 편안하게 신겠습니다 배송도빠르고 재질인게 잘붙는 약간 아쉬워요 모자,이쁘고 디자인도 편안하게 신겠습니다 배송도 빠르고 재질인 게 잘 붙는 약간 아쉬워요 모자,"['예쁘다', '디자인', '편안하다', '신다', '배송', '빠르다', '재질', '자다', '붙다', '아쉽다', '모자']"
1245,저렴하게 이뻐요 세일할때 상품도 샀어요 만족합니다,저렴하게 이 뻐요 세일할 때 상품도 샀어요 만족합니다,"['저렴하다', '상품', '사다', '만족하다']"
1246,찾고있었는데 좋아요 입을 이너로 얇지않아서 민소매 너무,찾고 있었는데 좋아요 입을 이너로 얇지 않아서 민소매 너무,"['찾다', '좋다', '얇다']"
1247,좋아요 무난하고 컬러감이 잘산것같아요살짝 오버핏 세일해서 믿고사는 디네댓항상,좋아요 무난하고 컬러감이 잘 산 것 같아요 살짝 오버핏 세일해서 믿고 사는 디네 댓항상,"['좋다', '무난', '컬러', '자다', '살짝', '오버핏', '일해', '믿다', '살다', '디네', '항상']"
1248,코디에나 좋게 자주 어울려요 어디 손이 같아요 가성비 가서,코디에나 좋게 자주 어울려 요 어디 손이 같아 요 가성비 가서,"['코디', '좋다', '자주', '어울리다', '가성비']"
1249,포인트로 컬러감이 착용하기 좋네요 제품입니다 매력적인 맞고 디테일과 기장도,포인트로 컬러감이 착용하기 좋네요 제품입니다 매력적인 맞고 디테일과 기장도,"['포인트', '컬러', '착용', '좋다', '제품', '매력', '맞다', '디테일', '일과', '기장']"
1250,빠르고 배송도 감사합니다 좋아요다음에 이용할게요 정석 입을게요 예쁩니다 없지만 쇼핑백이,빠르고 배송도 감사합니다 좋아요 다음에 이용할게요 정석 입을 게요 예쁩니다 없지만 쇼핑백이,"['빠르다', '배송', '감사하다', '좋다', '이용', '게요', '예쁘다']"
1251,훌륭하네요 추천합니다 질도 좋습니다 좋고 아주 가성비가,훌륭하네요 추천합니다 질도 좋습니다 좋고 아주 가성비가,"['훌륭하다', '추천', '질도', '좋다', '좋다', '아주', '가성비']"
1252,좋아요디자인도 예뻐요 생각보다 많이 들어가고,좋아요 디자인도 예뻐요 생각보다 많이 들어가고,"['좋다', '디자인', '예쁘다', '생각', '들어가다']"
1253,좋아요 가볍고 착용감 좋습니다만족합니다 속욧 착용하기 좋아요심플하게 반지가 깔끔하고 조끼,좋아요 가볍고 착용 감 좋습니다만족합니다 속 욧 착용하기 좋아요 심플하게 반지가 깔끔하고 조끼,"['좋다', '가볍다', '착용', '좋다', '만족하다', '착용', '좋다', '심플', '반지', '깔끔하다', '조끼']"
