,document,spac_doc,token_doc
2286,디자인이 디자인입니다 멋내기좋은 독득한거같으면서도 저렴하고 구매했습니다가격도 만족합니다감사합니다 귀여워서 귀여워요 정도입니다,디자인이 디자인입니다 멋내기 좋은 독득한 거 같으면서도 저렴하고 구매했습니다가격도 만족합니다 감사합니다 귀여워서 귀여워요 정도입니다,"['디자인', '디자인', '내기', '좋다', '저렴하다', '구매', '가격', '만족하다', '감사하다', '귀엽다', '귀엽다']"
2287,조금 있습니다 두께감이 있어 수축이 톡톡합니다세탁시 거칠다는 것과 냄새가 입기는,조금 있습니다 두께감이 있어 수축이 톡톡합니다 세탁 시 거칠다는 것과 냄새가 입기는,"['두께', '톡톡하다', '세탁', '거치다', '냄새', '입다']"
2288,편해서 좋아요 제품이라 전에 사용하는 머리 너무 감기,편해서 좋아요 제품이라 전에 사용하는 머리 너무 감기,"['편하다', '좋다', '제품', '사용', '머리']"
2289,프린팅도 좋았어요 좋고 이뻐요 유니크하고 싶었는데 상품 사이즈도 빨리 빨라서,프린팅도 좋았어요 좋고 이 뻐요 유니크하고 싶었는데 상품 사이즈도 빨리 빨라서,"['프린팅', '좋다', '좋다', '유니크', '상품', '사이즈', '빨리']"
2290,추천합니다 예뻐요 심플하고 스칼렛또블랙 반지,추천합니다 예뻐요 심플하고 스칼렛또 블랙 반지,"['추천', '예쁘다', '심플', '블랙', '반지']"
2291,해주세요 핏이 좋아요 좋네요 잘산거 오염이 오백원크기만큼 어깨에 아주 싸게,해주세요 핏이 좋아요 좋네요 잘 산 거 오염이 오백원 크기만큼 어깨에 아주 싸게,"['해주다', '좋다', '좋다', '자다', '크기', '어깨', '아주', '싸다']"
2292,좋아요 입으려고 운동할 샀는데 부드럽고 느낌이라 너무 감기는,좋아요 입으려고 운동할 샀는데 부드럽고 느낌이라 너무 감기는,"['좋다', '입다', '운동', '사다', '부드럽다', '느낌']"
2293,킁킁 친구네서 죠아요 조금 저렴한 왔지만 상태로 샀는데 사은품도 맡아보고,킁킁 친구네서 죠아요 조금 저렴한 왔지만 상태로 샀는데 사은품도 맡아보고,"['친구', '저렴하다', '상태', '사다', '품다']"
2294,해야하 아이보리 걱정했는데 구매하고 근데 많이 비치지 비칠 생각보다 않아서,해야 하 아이보리 걱정했는데 구매하고 근데 많이 비치지 비칠 생각보다 않아서,"['아이보리', '걱정', '구매', '비치다', '생각']"
2295,가성비 좋은 차콜 구매하고 그래도 느낌보단 느낌입니다 도는 바지 분홍빛,가성비 좋은 차콜 구매하고 그래도 느낌보단 느낌입니다 도는 바지 분홍빛,"['가성비', '좋다', '차콜', '구매', '느낌', '느낌', '바지']"
2296,핏도 저렴하게 잘산거 이뻐요블프라 여름이라 시원한 색상에 같아요,핏도 저렴하게 잘 산 거 이 뻐 요블프라 여름이라 시원한 색상에 같아요,"['저렴하다', '자다', '여름', '시원하다', '색상']"
2297,색감도 좋아요 좋고 예뻐서 느낌으로 머슬핏 입기 다시 사이트에 사진보다,색감도 좋아요 좋고 예뻐서 느낌으로 머슬핏 입기 다시 사이트에 사진보다,"['색감', '좋다', '좋다', '예쁘다', '느낌', '입다', '사진']"
2298,예뻐요 생각보다 휘뚜루마뚜루 어디든 괜찮았습니다 구매해봤는데 구입했는데 길어서 놀랐습니다기장은 두말할것,예뻐요 생각보다 휘뚜루마 뚜루 어디든 괜찮았습니다 구매해봤는데 구입했는데 길어서 놀랐습니다기장은 두말할 것,"['예쁘다', '생각', '휘뚜루', '휘뚜루', '괜찮다', '구매', '해봤다', '구입', '기다', '기장']"
2299,할인가에 너무 좋고 저렴하게 앞으로 그만한 득템해서 득템했네요 듯합니다 로고도,할인가에 너무 좋고 저렴하게 앞으로 그만한 득템해서 득템했네요 듯합니다 로고도,"['좋다', '저렴하다', '득템', '득템', '로고']"
2300,정품 카드 맥세이프 너무 사용하고 쉽게 크게 느낌이 보면 보여,정품 카드 맥세이프 너무 사용하고 쉽게 크게 느낌이 보면 보여,"['카드', '사용', '쉬다', '크게', '느낌']"
2301,추천받아서 좋습니다 그래도 느낌은 느낌이에요 다른 닦이는 많아서 보고 보다,추천받아서 좋습니다 그래도 느낌은 느낌이에요 다른 닦이는 많아서 보고 보다,"['추천', '좋다', '느낌', '느낌', '많다']"
2302,큰거할지 이뻐요ㅠㅠ 사이즈 미니할지 미니 너무 귀엽고 고민했는데,큰 거할지 이 뻐요ㅠㅠ 사이즈 미니할지 미니 너무 귀엽고 고민했는데,"['크다', '사이즈', '미니', '미니', '귀엽다', '고민']"
2303,포장도 와서 배송도 바르고 마음에 듭니다 깔끔하게,포장도 와서 배송도 바르고 마음에 듭니다 깔끔하게,"['포장', '배송', '바르다', '마음', '듭니', '깔끔하다']"
2304,좋습니다 주기 포인트 아무 기본템으로 입으면서 마뚜루 휘뚜루 그냥 겨울,좋습니다 주 기 포인트 아무 기본템으로 입으면서 마 뚜루 휘뚜루 그냥 겨울,"['좋다', '포인트', '아무', '입다', '휘뚜루', '휘뚜루', '겨울']"
2305,좋네요 좋고 향도 거품이 만족스럽습니다 쫀쫀해서 세정력도 잘밀려요 보이는게 수염이,좋네요 좋고 향도 거품이 만족스럽습니다 쫀쫀해서 세정력도 잘 밀려 요 보이는 게 수염이,"['좋다', '좋다', '거품', '만족스럽다', '쫀쫀해', '정력', '자다', '밀리다']"
2306,피케티는 폴로입니다여자친구 포니로고 퀄리티 좋아하네요좋은 역시 선물해줬는데 상품 모두 감사합니다,피케티는 폴로입니다 여자친구 포니로 고 퀄리티 좋아하네요 좋은 역시 선물해줬는데 상품 모두 감사합니다,"['폴로', '여자친구', '퀄리티', '좋아하다', '좋다', '선물', '해주다', '상품', '감사하다']"
2307,화사한 봄을 겨울에 귀여워요 다녔더니 되어 맞이한 먼저 반팔에 사람이,화사한 봄을 겨울에 귀여워요 다녔더니 되어 맞이 한 먼저 반팔에 사람이,"['화사하다', '겨울', '귀엽다', '다니다', '맞이', '먼저', '사람']"
2308,팔길이도 코트 있어요 왔습니다 연휴가 살짝 빠르게 배송 맞고 느낌도,팔길이도 코트 있어요 왔습니다 연휴가 살짝 빠르게 배송 맞고 느낌도,"['길이', '코트', '살짝', '빠르다', '배송', '맞다', '느낌']"
2309,충만합니다 좋게 영양감 않고 세트로 샴푸랑 사용중입니다 끈적이지 구입해서 가성비,충만합니다 좋게 영양감 않고 세트로 샴푸랑 사용 중입니다 끈적이지 구입해서 가성비,"['좋다', '세트', '샴푸', '사용', '이지', '구입', '가성비']"
2310,좋습니다 아주 투웨이라 생각했던 입어져요그리고 두께감이에요 두꺼워서 부드러워서 핏이 튼튼하고,좋습니다 아주 투웨이라 생각했던 입어져요 그리고 두께감이에요 두꺼워서 부드러워서 핏이 튼튼하고,"['좋다', '아주', '투웨이', '생각', '입다', '두께', '두껍다', '부드럽다', '튼튼하다']"
2311,사이즈 힘든 한줄기 길이감 너비도 대비 빛이에요 빨리 선호하고 아방한,사이즈 힘든 한 줄기 길이 감 너비도 대비 빛이에요 빨리 선호하고 아방한,"['사이즈', '힘드다', '길이', '대비', '빨리', '선호']"
2312,실물로는 잘받앗습니다 그린색이 제일고급지네요 뒤에 불편하네요 잘샀어요ㅎㅎ 재질톡톡하고 밴딩아니고 접히면,실물로는 잘 받앗습니다 그린 색이 제일 고급지네요 뒤에 불편하네요 잘 샀어요 ㅎㅎ 재질톡톡하고 밴딩 아니고 접히면,"['실물', '로는', '자다', '그린', '고급', '불편하다', '자다', '사다', '재질', '톡톡하다', '밴딩', '접다']"
2313,구매했어요 좋아요 분리가 처음 접하는 브랜드 네이밍 발림성 브랜드인데 이라,구매했어요 좋아요 분리가 처음 접하는 브랜드 네이밍 발림성 브랜드인데 이라,"['구매', '좋다', '처음', '브랜드', '발림', '브랜드', '이르다']"
2314,핏도 입을 싼가격에 나쁘지 올라와 바지 알아보다 않네요 구매합니다 구매하려,핏도 입을 싼 가격에 나쁘지 올라와 바지 알아보다 않네요 구매합니다 구매하려,"['싸다', '가격', '나쁘다', '올라오다', '바지', '구매', '구매']"
2315,저렴하게 임박으로 예쁘게 빨랐어요유통기한 배송 발색 되고 구매했어요,저렴하게 임박으로 예쁘게 빨랐어요 유통기한 배송 발색 되고 구매했어요,"['저렴하다', '예쁘다', '빠르다', '배송', '발색', '구매']"
2316,핏도 이쁘네요 이뿐데 원단감이 미쳤습니다 너무,핏도 이 쁘네요 이 뿐 데 원단감이 미쳤습니다 너무,"['예쁘네', '미치다']"
2317,너무 어떻게 자라는 떠서 머리가 빨리 사봤습니다 옆머리가 효과있길 편이라,너무 어떻게 자라는 떠서 머리가 빨리 사봤습니다 옆머리가 효과 있길 편이라,"['뜨다', '머리', '빨리', '사보다', '머리', '효과', '편이']"
2318,합리적인 할수 하던중 잠옷이길래 잠옷 있는 여름 맘에 디깅 드네요,합리적인 할 수 하던 중 잠옷이길래 잠옷 있는 여름 맘에 디깅 드네요,"['합리', '잠옷', '이기다', '잠옷', '여름', '드네']"
2319,좋아요 재질이라 이쁘네요 생각보다 색도 따뜻하고 도톰하,좋아요 재질이라 이 쁘네요 생각보다 색도 따뜻하고 도톰하,"['좋다', '재질', '예쁘네', '생각', '색도', '따뜻하다', '도톰하다']"
2320,아주 맞게 선물용으로 작았지만 필수라생각합니다 피치그림이 생각보다는 귀엽고사이즈도 앙증이뻐요작아도들어갈건 만족합니등,아주 맞게 선물용으로 작았지만 필수라 생각합니다 피치 그림이 생각보다는 귀엽고 사이즈도 앙증이 뻐요작아도 들어갈 건 만족합니 등,"['아주', '맞다', '선물', '작다', '필수', '생각', '그림', '생각', '귀엽다', '사이즈', '앙증', '작다', '들어가다', '만족하다']"
2321,확실히 크기로 아래 글램팜 글램팜으로 기신분들도 기장감이 김에 까지 남자분들,확실히 크기로 아래 글램 팜 글램팜으로 기 신 분들도 기 장감이 김에 까지 남자분들,"['확실하다', '크기', '아래', '파다', '파다', '남자', '분들']"
2322,입을깨요세일가로 입니다 이쁩니다 와이드 슬랙스는 세상최고 세미 무신사스탠다드 너무 구매했습니다핏은리얼이요즘,입을 깨 요세일가로 입니다 이쁩니다 와이드 슬랙스는 세상 최고 세미 무신사 스탠다드 너무 구매했습니다핏은 리얼이 요즘,"['예쁘다', '와이드', '슬랙스', '최고', '세미', '물다', '스탠다드', '구매', '요즘']"
2323,아주 한여름 좋습ㄴㅣ다 자연스럽고 입기 유니크한편임니다 옴팡집니다 세박자가 색감도 색감,아주 한 여름 좋습 ㄴㅣ 다 자연스럽고 입기 유니크한편 임니다 옴팡집니다 세박자가 색감도 색감,"['아주', '여름', '좋다', '자연스럽다', '입다', '유니크', '지다', '색감', '색감']"
2324,예쁘고 않아요 살짝 마냥하얗지는 노래요 깔끔하고 귀엽고,예쁘고 않아 요 살짝 마냥 하얗지는 노래요 깔끔하고 귀엽고,"['예쁘다', '살짝', '하얗다', '깔끔하다', '귀엽다']"
2325,핏도 투웨이 가능하고 가을 같아요 들어가면 무난하고 밑단 사용할것 샀습니다,핏도 투웨이 가능하고 가을 같아 요 들어가면 무난하고 밑단 사용할 것 샀습니다,"['투웨이', '가능하다', '가을', '들어가다', '무난', '밑단', '사용', '사다']"
2326,짱짱합니다오래 자체가 있을 입을 예쁘네요재질도 빠르고속옷 배송도 디자인이 듯요,짱짱합니다 오래 자체가 있을 입을 예쁘네요 재질도 빠르고 속옷 배송도 디자인이 듯요,"['짱짱하다', '오래', '예쁘다', '재질', '빠르다', '속옷', '배송', '디자인']"
2327,한사이즈 편하게 조금 입을것 여름에 업했더니 얇고 시원해서 사이즈표 보다,한 사이즈 편하게 조금 입을 것 여름에 업했더니 얇고 시원해서 사이즈 표 보다,"['사이즈', '편하다', '여름', '얇다', '시원하다', '사이즈']"
2328,너무 좋아요 좋습니다 인사일런스 예쁩니다 디테일,너무 좋아요 좋습니다 인사 일런스 예쁩니다 디테일,"['좋다', '좋다', '예쁘다', '디테일']"
2329,편합니다 편하게 출퇴근시 있어서 있네요 입을 사무실 밴드가,편합니다 편하게 출퇴근시 있어서 있네요 입을 사무실 밴드가,"['편하다', '편하다', '출퇴근', '사무실', '밴드']"
2330,큰거는 크게 입어야 이쁠거 이건 싫어서 사이즈 너무 구매했는데 같라요,큰 거는 크게 입어야 이쁠 거 이건 싫어서 사이즈 너무 구매했는데 같라요,"['크다', '크게', '입다', '예쁘다', '싫다', '사이즈', '구매']"
2331,주머니 좋고 있어서 사이즈도 배색이 귀여워요만족합니당,주머니 좋고 있어서 사이즈도 배색이 귀여워요 만족합니당,"['주머니', '좋다', '사이즈', '배색', '귀엽다', '만족하다']"
2332,입어도 혹은 해서 재질도 있네요 이유가 이뻐요 유명한건 오오 엄청,입어도 혹은 해서 재질도 있네요 이유가 이 뻐요 유명한 건 오오 엄청,"['입다', '재질', '이유', '유명하다', '오오']"
2333,정사이즈 ㅊㅊ입니다 국밥템 말할필요가 있나요 반스는 신는데 맞네요무조건 반업하시고 발볼넓으신분들은,정 사이즈 ㅊㅊ입니다 국밥템 말할 필요가 있나요 반스는 신는데 맞네요무조건 반업하시고 발볼 넓으신 분들은,"['사이즈', '국밥', '필요', '반스', '신다', '맞다', '무조건', '발볼', '넓다']"
2334,있어요 무난합니다 괜찮네요 컬러 초겨울까지 초가을부터 무게감은 이제품 바지랑 입을려고샀어요,있어요 무난합니다 괜찮네요 컬러 초겨울까지 초가을부터 무게감은 이 제품 바지랑 입을 려고 샀어요,"['무난', '괜찮다', '컬러', '초가을', '무게', '감다', '제품', '바지', '려고', '사다']"
2335,하네요 좋다고 있어요 입기 입고 아우터로 신랑 두툼해서 너무 꽃샘추위에,하네요 좋다고 있어요 입기 입고 아우터로 신랑 두툼해서 너무 꽃샘추위에,"['좋다', '입다', '입다', '아우', '신랑', '두툼해']"
2336,얇아서 패트와 단독으론 매트는 못참죠 입으려고요 부담스럽고 셔츠안에 포인트로 속옷,얇아서 패트와 단독으론 매트는 못 참죠 입으려고 요 부담스럽고 셔츠 안에 포인트로 속옷,"['얇다', '단독', '매트', '입다', '부담스럽다', '셔츠', '포인트', '속옷']"
2337,너무 좋아요 좋고 한번 무료배송이라 빨았는데 좋습니다가성비 구매가능해서 부담없이 기본티로,너무 좋아요 좋고 한 번 무료 배송이라 빨았는데 좋습니다가 성비 구매 가능해서 부담 없이 기본티로,"['좋다', '좋다', '무료', '배송', '빨다', '좋다', '성비', '구매', '가능하다', '부담']"
2338,살짝 많이 펑퍼짐해서 얇고 나팔이면 아쉬워요두껍고 무겁고 고급스럽진 괜찮은 달수있어서,살짝 많이 펑 퍼짐해서 얇고 나팔이면 아쉬워 요 두껍고 무겁고 고급스럽진 괜찮은 달 수 있어서,"['살짝', '퍼지다', '얇다', '아쉽다', '두껍다', '무겁다', '고급스럽다', '괜찮다']"
2339,외출용으로 칠때쓰는게 골프 하지않고 더울듯싶어요 보입니다일상 보니 받아보고 머리가재질도 맟춰서,외출용으로 칠 때 쓰는 게 골프 하지 않고 더울듯 싶어요 보입니다 일상 보니 받아 보고 머리가 재질도 맟 춰서,"['외출', '쓰다', '골프', '덥다', '머리', '재질', '추다']"
2340,편하고 있어서 좋아용 안에 신기좋아요요즘스타일이라 깔창 겨울에도 트임이 통이 예뻐요,편하고 있어서 좋아용 안에 신기 좋아요 요즘 스타일이라 깔창 겨울에도 트임이 통이 예뻐요,"['편하다', '좋다', '신기', '좋다', '요즘', '스타일', '깔창', '겨울', '에도', '트이다', '예쁘다']"
2341,계속 지속력 써보려구여ㅋㅋ 방지효과는 괜찮습니다탈모 할인할때마다 줍줍합니다 장바구니 담아두고 기본템이니까,계속 지속력 써보려 구여ㅋㅋ 방지 효과는 괜찮습니다 탈모 할인할 때마다 줍줍합니다 장바구니 담아두고 기 본템이니까,"['지속', '구여', '효과', '괜찮다', '할인', '줍다', '줍다']"
2342,맘에들어요 잘입겠습니다 생각했던 상즈랑 동일하고 옷이 디자인이랑 두툼하긴한데 느낌이좋음,맘에 들어 요 잘 입겠습니다 생각했던 상즈랑 동일하고 옷이 디자인이랑 두툼 하긴 한데 느낌이 좋음,"['자다', '입다', '생각', '동일하다', '디자인', '두툼', '느낌', '좋다']"
2343,포인트 진짜 겉옷 눈에 느낌입니다 도프제이슨 들고 띄어서 만드는 맘에,포인트 진짜 겉옷 눈에 느낌입니다 도프제이슨 들 고 띄어서 만드는 맘에,"['포인트', '느낌', '만들다']"
2344,많이 같아요 따뜻해서 스타일입니다편하고 원했던 하기 포인트로 착용할거 좋아요여름에 입으면,많이 같아 요 따뜻해서 스타일입니다 편하고 원했던 하기 포인트로 착용할 거 좋아요 여름에 입으면,"['따뜻하다', '스타일', '편하다', '원하다', '포인트', '착용', '좋다', '여름', '입다']"
2345,좋아요 있어서 효과도 초등학생 지폐도 순한거같아요 선크림중에 사줬어요카드랑 미백 넣을수,좋아요 있어서 효과도 초등학생 지폐도 순한 거 같아 요 선크림 중에 사 줬어요 카드랑 미백 넣을 수,"['좋다', '효과', '순하다', '카드', '미백', '넣다']"
2346,입어도 좋고 수납력 메고 귀여워서 다녀요 아이패드도 들어가요 단독으로 두께도,입어도 좋고 수납력 메고 귀여워서 다녀 요 아이패드도 들어가요 단독으로 두께도,"['입다', '좋다', '수납', '메다', '귀엽다', '다니다', '들어가다', '단독', '두께']"
2347,편하게 너무 있었습니다부산에서도 관람할 생겨서 기회가 좋았습니다 몰리지 전시회를 사람이,편하게 너무 있었습니다 부산에서도 관람할 생겨서 기회가 좋았습니다 몰리지 전시회를 사람이,"['편하다', '에서도', '생기다', '기회', '좋다', '사람']"
2348,맘에 받자마자 ㅎㅎ 듭니다 갬성다른색도 베이비티 유행하는 구매하려구욧 핏감 뒤에,맘에 받자마자 ㅎㅎ 듭니다 갬성 다른 색도 베이비티 유행하는 구매하려 구욧 핏감 뒤에,"['듭니', '개다', '색도', '유행', '구매', '핏감']"
2349,이뻐요 이뻐요너무너무 착화감좋고 아주빠른배송감사 트레킹에딱 컬러감 힘듬패턴은 블루의 신어도 아니,이 뻐요 이 뻐 요 너 무너무 착화감 좋고 아주 빠른 배송감사 트레킹에 딱 컬러감 힘듬 패턴은 블루의 신어도 아니,"['좋다', '아주', '빠르다', '배송', '감사', '컬러', '힘드다', '패턴', '블루', '신어']"
2350,한데섀도가 탁하긴 저렴하게 오니까 엄청 아이섀도가 색이 산거 같이 같아요,한데 섀도가 탁하긴 저렴하게 오니까 엄청 아이섀도가 색이 산 거 같이 같아요,"['저렴하다', '니까']"
2351,좋아요 않아서 너무 자극적이지 은은하고 우디향 크롭이에요 짧지도 원하던 기장의,좋아요 않아서 너무 자극적이지 은은하고 우디 향 크롭이에 요 짧지도 원하던 기장의,"['좋다', '자극', '이지', '은은하다', '짧다', '원하다', '기장']"
2352,좋고 만족합니다 너무 의향있습니다 상품 다시 퀄리티 좋아서 입겠습니다 가격도,좋고 만족합니다 너무 의향 있습니다 상품 다시 퀄리티 좋아서 입겠습니다 가격도,"['좋다', '만족하다', '의향', '상품', '퀄리티', '좋다', '입다', '가격']"
2353,좋아요 퀄리티 착용감도 쫀쫀 양말 얇으면서도 대박이네요 핏되서 톤다운 적당히,좋아요 퀄리티 착용 감도 쫀쫀 양말 얇으면서도 대박이네요 핏되서 톤 다운 적당히,"['좋다', '퀄리티', '착용', '감다', '쫀쫀', '양말', '얇다', '대박', '핏되', '다운', '적당하다']"
2354,하얀색에다가 토끼랑 잘어울리는거같아요 옷이 소재자체는 마음에들진않지만 디자인이 되게 다했네요 글씨도,하얀색에 다가 토끼랑 잘 어울리는 거 같아 요 옷이 소재 자체는 마음에 들진 않지만 디자인이 되게 다 했네요 글씨도,"['다가', '자다', '어울리다', '소재', '마음', '디자인', '되게']"
2355,생각보다 엄청 당황했지만 무거워서 잘입을거같아여 이뻐서 업해서 허허 나오는 사는거,생각보다 엄청 당황했지만 무거워서 잘 입을 거 같아 여 이 뻐서 업해서 허 허 나오는 사는 거,"['생각', '당황', '무거워', '자다', '허다', '허다', '살다']"
2356,좋아요 예뻐요 코듀로이도 오묘하고 얇지 않고 색상이 굵직해서 최근에 중에서,좋아요 예뻐요 코듀로이도 오묘하고 얇지 않고 색상이 굵직해서 최근에 중에서,"['좋다', '예쁘다', '오묘하다', '얇다', '색상', '최근']"
2357,편하게 잘입어질것같습니다 워낙유명해서고민없이 슬림나인 구매했습니다 체커보드를사이즈는 업했습니다 신고 다닐게요 가격에,편하게 잘 입어질 것 같습니다 워낙 유명해서 고민 없이 슬림 나인 구매했습니다 체커 보드를 사이즈는 업했습니다 신고 다닐게요 가격에,"['편하다', '자다', '입다', '워낙', '유명하다', '고민', '슬림', '나인', '구매', '사이즈', '신고', '다니다', '가격']"
2358,한데 여름에 느낌이긴 딱이에요푹신한 수도 신으면 싶은 아플 예쁘고 팬츠에도,한데 여름에 느낌이 긴 딱이에 요 푹 신한 수도 신으면 싶은 아플 예쁘고 팬츠에도,"['여름', '느낌', '기다', '딱이다', '수도', '신다', '아프다', '예쁘다', '팬츠', '에도']"
2359,편입니다오버사이즈는 추천합니다 이쁜데 옷이 스타일은 무거운,편입니다오버사이즈는 추천합니다 이쁜데 옷이 스타일은 무거운,"['편입', '오버', '사이즈', '추천', '예쁘다', '스타일', '무겁다']"
2360,예쁜 입으면 있는 무난하게 아닙니다 가능합니다 코디가 안에 핏이 크게,예쁜 입으면 있는 무난하게 아닙니다 가능합니다 코디가 안에 핏이 크게,"['예쁘다', '입다', '무난', '가능하다', '코디', '크게']"
2361,같아요 사이즈가 컷으면 좋은데 이쁠거 상의도 탄탄하도 어울리네요 아무거나 스몰,같아 요 사이즈가 컷으면 좋은데 이 쁠 거 상의도 탄탄하도 어울리네 요 아무거나 스몰,"['사이즈', '좋다', '상의', '탄탄하다', '어울리다', '아무', '거나', '스몰']"
2362,했습니다 핏이 프린트 찾고 좋아서 있었는데 실착 바로 맨투맨 들어간,했습니다 핏이 프린트 찾고 좋아서 있었는데 실착 바로 맨투맨 들어간,"['프린트', '찾다', '좋다', '맨투맨', '들어가다']"
2363,진짜 좋아요 히히 운동용 까고 산건데 소재에요편하고 앞머리 있으려고 집에서,진짜 좋아요 히 히 운동용 까고 산 건데 소재에 요편하고 앞머리 있으려고 집에서,"['좋다', '운동', '건데', '소재']"
2364,힙하게도 편하고 일할때 여유있어요 어울려요 신어도 사이즈도,힙하게도 편하고 일할 때 여유 있어요 어울려 요 신어도 사이즈도,"['편하다', '여유', '어울리다', '신어', '사이즈']"
2365,가성비 좋게 굿입니다 예쁜컬러감 지립니다적당한오버핏 잘구매했어요 구매한것같아요 기본벨트로 너무좋습니다 원하는,가성비 좋게 굿입니다 예쁜 컬러감 지립니다 적당한 오버핏 잘 구매했어요 구매한 것 같아요 기본벨트로 너무 좋습니다 원하는,"['가성비', '좋다', '예쁘다', '컬러', '적당하다', '오버핏', '자다', '구매', '구매', '벨트', '좋다', '원하다']"
2366,진짜 같아요 커서 야무집니다 사이즈는 나을거 가시는게 하는데 피부가 장난아니다,진짜 같아 요 커서 야무집니다 사이즈는 나을 거 가시는 게 하는데 피부가 장난 아니다,"['커서', '야무지다', '사이즈', '피부', '장난']"
2367,같아요 귀여워요 저렴했음 깜찍하고 시원해요 시크하고 샀을 조오금 입을것 봄에,같아 요 귀여워요 저렴했음 깜찍하고 시원해요 시크하고 샀을 조오금 입을 것 봄에,"['귀엽다', '저렴하다', '시원하다', '사다']"
